{
  "schemaVersion": 2,
  "contentRevision": "ws-content-r2",
  "domain": "events",
  "records": [
    {
      "id": "EV50-D21-MOVING-BORDER",
      "sourceDocumentId": "EVENT-DATA-D50-001",
      "enabled": true,
      "eventKind": "MAIN_EVENT",
      "firstDay": 21,
      "executionOpcode": "RUN_EVENT_OBJECTIVE",
      "objectiveText": "이동 경계 3회 측정→전후 표본 2쌍",
      "telegraphSpaceText": "최근 이동 경로 3점, 20초 방향음",
      "failureAlternativeText": "범용 오염 표식으로 전환, 표본 직접 지급 없음",
      "pressureProfileId": "PR50-CORRUPTION-TRAIL",
      "partyThreat": [
        32,
        42,
        51
      ],
      "requiredConnectionText": "C14, RS-D21",
      "rewardText": "정화 촉매",
      "raw": [
        "EV50-D21-MOVING-BORDER",
        "이동 경계 3회 측정→전후 표본 2쌍",
        "최근 이동 경로 3점, 20초 방향음",
        "범용 오염 표식으로 전환, 표본 직접 지급 없음"
      ]
    },
    {
      "id": "EV50-D22-MUTATION-MIRROR",
      "sourceDocumentId": "EVENT-DATA-D50-001",
      "enabled": true,
      "eventKind": "MAIN_EVENT",
      "firstDay": 22,
      "executionOpcode": "RUN_EVENT_OBJECTIVE",
      "objectiveText": "같은 계열 변이 2체 관측→다른 대응 축 2개 기록",
      "telegraphSpaceText": "변이 아이콘 2개 공개",
      "failureAlternativeText": "처치 대신 90초 관측 가능",
      "pressureProfileId": "PR50-MUTATION-SPLIT",
      "partyThreat": [
        34,
        44,
        54
      ],
      "requiredConnectionText": "변이 비교",
      "rewardText": "변이 표본",
      "raw": [
        "EV50-D22-MUTATION-MIRROR",
        "같은 계열 변이 2체 관측→다른 대응 축 2개 기록",
        "변이 아이콘 2개 공개",
        "처치 대신 90초 관측 가능"
      ]
    },
    {
      "id": "EV50-D23-PURIFIER-PARASITE",
      "sourceDocumentId": "EVENT-DATA-D50-001",
      "enabled": true,
      "eventKind": "MAIN_EVENT",
      "firstDay": 23,
      "executionOpcode": "RUN_EVENT_OBJECTIVE",
      "objectiveText": "출력 흡수선 2개 절단→정화 30초 유지",
      "telegraphSpaceText": "시설 또는 휴대 정화기 중심",
      "failureAlternativeText": "시설 없으면 FAC-P05 가상 출력점 2개",
      "pressureProfileId": "PR50-PURIFY-JAM",
      "partyThreat": [
        36,
        47,
        58
      ],
      "requiredConnectionText": "C15~C17",
      "rewardText": "균열 가루·촉매",
      "raw": [
        "EV50-D23-PURIFIER-PARASITE",
        "출력 흡수선 2개 절단→정화 30초 유지",
        "시설 또는 휴대 정화기 중심",
        "시설 없으면 FAC-P05 가상 출력점 2개"
      ]
    },
    {
      "id": "EV50-D24-LEDGER-TRACK",
      "sourceDocumentId": "EVENT-DATA-D50-001",
      "enabled": true,
      "eventKind": "MAIN_EVENT",
      "firstDay": 24,
      "executionOpcode": "RUN_EVENT_OBJECTIVE",
      "objectiveText": "운반자 표식 이전 2회→추적자 제압",
      "telegraphSpaceText": "실제 아이템 강탈 없음",
      "failureAlternativeText": "원장·상자 파괴 없음, 표식 시간 초과 후 재시도",
      "pressureProfileId": "PR50-CARGO-HUNT",
      "partyThreat": [
        38,
        49,
        61
      ],
      "requiredConnectionText": "운반 방어",
      "rewardText": "금속·신호",
      "raw": [
        "EV50-D24-LEDGER-TRACK",
        "운반자 표식 이전 2회→추적자 제압",
        "실제 아이템 강탈 없음",
        "원장·상자 파괴 없음, 표식 시간 초과 후 재시도"
      ]
    },
    {
      "id": "EV50-D25-MUTATION-MAP",
      "sourceDocumentId": "EVENT-DATA-D50-001",
      "enabled": true,
      "eventKind": "MAIN_EVENT",
      "firstDay": 25,
      "executionOpcode": "RUN_EVENT_OBJECTIVE",
      "objectiveText": "변이 3범주·2출처 등록→연구 큐 제출",
      "telegraphSpaceText": "지형 무관 Display 표본판",
      "failureAlternativeText": "부족 범주는 EVT-C02 가중 +50%",
      "pressureProfileId": "PR50-AUGMENTED-MUTATION",
      "partyThreat": [
        40,
        52,
        64
      ],
      "requiredConnectionText": "RS-D25",
      "rewardText": "정제 변이",
      "raw": [
        "EV50-D25-MUTATION-MAP",
        "변이 3범주·2출처 등록→연구 큐 제출",
        "지형 무관 Display 표본판",
        "부족 범주는 EVT-C02 가중 +50%"
      ]
    },
    {
      "id": "EV50-D26-CONFLICTED-ORDER",
      "sourceDocumentId": "EVENT-DATA-D50-001",
      "enabled": true,
      "eventKind": "MAIN_EVENT",
      "firstDay": 26,
      "executionOpcode": "RUN_EVENT_OBJECTIVE",
      "objectiveText": "서로 상충한 두 신호 중 순차 안정화",
      "telegraphSpaceText": "동시 입력 요구 없음",
      "failureAlternativeText": "한 축 완료 보존, 다음 Day 재후보",
      "pressureProfileId": "PR50-DUAL-OBJECTIVE",
      "partyThreat": [
        42,
        55,
        67
      ],
      "requiredConnectionText": "C18",
      "rewardText": "신호·연구 기록",
      "raw": [
        "EV50-D26-CONFLICTED-ORDER",
        "서로 상충한 두 신호 중 순차 안정화",
        "동시 입력 요구 없음",
        "한 축 완료 보존, 다음 Day 재후보"
      ]
    },
    {
      "id": "EV50-D27-RIFT-STABILITY",
      "sourceDocumentId": "EVENT-DATA-D50-001",
      "enabled": true,
      "eventKind": "MAIN_EVENT",
      "firstDay": 27,
      "executionOpcode": "RUN_EVENT_OBJECTIVE",
      "objectiveText": "이동 균열 3회 추적→6초 봉합",
      "telegraphSpaceText": "방향 8분면·강도 3단계",
      "failureAlternativeText": "놓치면 C04로 재후보, 자원 직접 생성 금지",
      "pressureProfileId": "PR50-PURIFY-JAM",
      "partyThreat": [
        44,
        57,
        70
      ],
      "requiredConnectionText": "C19, RS-D27",
      "rewardText": "안정화 코어",
      "raw": [
        "EV50-D27-RIFT-STABILITY",
        "이동 균열 3회 추적→6초 봉합",
        "방향 8분면·강도 3단계",
        "놓치면 C04로 재후보, 자원 직접 생성 금지"
      ]
    },
    {
      "id": "EV50-D28-ABYSSAL-COST",
      "sourceDocumentId": "EVENT-DATA-D50-001",
      "enabled": true,
      "eventKind": "MAIN_EVENT",
      "firstDay": 28,
      "executionOpcode": "RUN_EVENT_OBJECTIVE",
      "objectiveText": "심연 대가 3종 미리보기→고위험 표본 1개 회수",
      "telegraphSpaceText": "전투 전 비가역 경고",
      "failureAlternativeText": "선택·제작을 강제하지 않음",
      "pressureProfileId": "PR50-ELITE-MUTATION",
      "partyThreat": [
        47,
        61,
        75
      ],
      "requiredConnectionText": "심연 대가 공개",
      "rewardText": "정화 매질",
      "raw": [
        "EV50-D28-ABYSSAL-COST",
        "심연 대가 3종 미리보기→고위험 표본 1개 회수",
        "전투 전 비가역 경고",
        "선택·제작을 강제하지 않음"
      ]
    },
    {
      "id": "EV50-D29-CORE-TRIANGULATION",
      "sourceDocumentId": "EVENT-DATA-D50-001",
      "enabled": true,
      "eventKind": "MAIN_EVENT",
      "firstDay": 29,
      "executionOpcode": "RUN_EVENT_OBJECTIVE",
      "objectiveText": "3방향 신호 측정→호출 공간 검사",
      "telegraphSpaceText": "35초, 3말뚝 순차 가능",
      "failureAlternativeText": "위치 실패 시 말뚝 무료 재배치 1회",
      "pressureProfileId": "PR50-BOSS-PRELUDE-30",
      "partyThreat": [
        50,
        65,
        80
      ],
      "requiredConnectionText": "C20·호출",
      "rewardText": "렌즈·호출 보충",
      "raw": [
        "EV50-D29-CORE-TRIANGULATION",
        "3방향 신호 측정→호출 공간 검사",
        "35초, 3말뚝 순차 가능",
        "위치 실패 시 말뚝 무료 재배치 1회"
      ]
    },
    {
      "id": "EV50-D31-BREAK-TELEMETRY",
      "sourceDocumentId": "EVENT-DATA-D50-001",
      "enabled": true,
      "eventKind": "MAIN_EVENT",
      "firstDay": 31,
      "executionOpcode": "RUN_EVENT_OBJECTIVE",
      "objectiveText": "서로 다른 브레이크 수단 3개 기록",
      "telegraphSpaceText": "훈련 보상 없음 태그 대상 포함 가능",
      "failureAlternativeText": "1인도 actionTag 3개로 완료",
      "pressureProfileId": "PR50-HEAVY-CHANNEL",
      "partyThreat": [
        50,
        65,
        80
      ],
      "requiredConnectionText": "C21, RS-D31",
      "rewardText": "경화 골재",
      "raw": [
        "EV50-D31-BREAK-TELEMETRY",
        "서로 다른 브레이크 수단 3개 기록",
        "훈련 보상 없음 태그 대상 포함 가능",
        "1인도 actionTag 3개로 완료"
      ]
    },
    {
      "id": "EV50-D32-TAG-TRIAL",
      "sourceDocumentId": "EVENT-DATA-D50-001",
      "enabled": true,
      "eventKind": "MAIN_EVENT",
      "firstDay": 32,
      "executionOpcode": "RUN_EVENT_OBJECTIVE",
      "objectiveText": "INTERRUPTIBLE/PARTIAL/UNBREAKABLE 각각 1회 대응",
      "telegraphSpaceText": "문자+아이콘+소리",
      "failureAlternativeText": "실패 기록도 연구 비교에 인정, 보상은 성공분만",
      "pressureProfileId": "PR50-INTERRUPT-TAGS",
      "partyThreat": [
        53,
        69,
        85
      ],
      "requiredConnectionText": "중단 태그",
      "rewardText": "공진 코일",
      "raw": [
        "EV50-D32-TAG-TRIAL",
        "INTERRUPTIBLE/PARTIAL/UNBREAKABLE 각각 1회 대응",
        "문자+아이콘+소리",
        "실패 기록도 연구 비교에 인정, 보상은 성공분만"
      ]
    },
    {
      "id": "EV50-D33-SIEGE-BORE",
      "sourceDocumentId": "EVENT-DATA-D50-001",
      "enabled": true,
      "eventKind": "MAIN_EVENT",
      "firstDay": 33,
      "executionOpcode": "RUN_EVENT_OBJECTIVE",
      "objectiveText": "시설 또는 이동 신호 2목표 중 하나 보호",
      "telegraphSpaceText": "건축 무차별 파괴 없음",
      "failureAlternativeText": "시설 없으면 파티 표식 추적 모드",
      "pressureProfileId": "PR50-FACILITY-SIEGE",
      "partyThreat": [
        56,
        73,
        90
      ],
      "requiredConnectionText": "C22",
      "rewardText": "수리·골재",
      "raw": [
        "EV50-D33-SIEGE-BORE",
        "시설 또는 이동 신호 2목표 중 하나 보호",
        "건축 무차별 파괴 없음",
        "시설 없으면 파티 표식 추적 모드"
      ]
    },
    {
      "id": "EV50-D34-METHOD-DECAY",
      "sourceDocumentId": "EVENT-DATA-D50-001",
      "enabled": true,
      "eventKind": "MAIN_EVENT",
      "firstDay": 34,
      "executionOpcode": "RUN_EVENT_OBJECTIVE",
      "objectiveText": "같은 수단 2회→다른 수단 교대",
      "telegraphSpaceText": "감쇠 수치 HUD",
      "failureAlternativeText": "특정 무기 불필요, 회피 후 공격도 다른 축",
      "pressureProfileId": "PR50-PARRY-LEARN",
      "partyThreat": [
        59,
        77,
        94
      ],
      "requiredConnectionText": "C23",
      "rewardText": "패턴 잔재",
      "raw": [
        "EV50-D34-METHOD-DECAY",
        "같은 수단 2회→다른 수단 교대",
        "감쇠 수치 HUD",
        "특정 무기 불필요, 회피 후 공격도 다른 축"
      ]
    },
    {
      "id": "EV50-D35-FOUR-AUTHORITIES",
      "sourceDocumentId": "EVENT-DATA-D50-001",
      "enabled": true,
      "eventKind": "MAIN_EVENT",
      "firstDay": 35,
      "executionOpcode": "RUN_EVENT_OBJECTIVE",
      "objectiveText": "부품 A~D 기록 비교, 전투 중 2개 신호 보호",
      "telegraphSpaceText": "부품 소각·월드 드롭 없음",
      "failureAlternativeText": "원장 불일치 시 사건 동결·감사",
      "pressureProfileId": "PR50-AUGMENTED-BREAK",
      "partyThreat": [
        62,
        81,
        99
      ],
      "requiredConnectionText": "Lv35·기록",
      "rewardText": "공진·연구",
      "raw": [